{
  "schemaVersion": 1,
  "package": "adaptive-implementation-execution",
  "installTargets": ["copilot", "codex", "agent-skills"],
  "ownedSkills": ["adaptive-implementation-execution"],
  "ownedAgents": ["bounded-residual-implementation-owner", "decision-surface-implementation-owner"],
  "ownedInstructions": [],
  "dependencies": ["codex-profile-finalizer"],
  "runtimeBoundary": "Portable Skill and agents; Codex model mapping remains in the profile finalizer."
}
