{
  "schemaVersion": 1,
  "package": "persistent-purpose-review",
  "installTargets": ["copilot", "codex", "agent-skills"],
  "ownedSkills": ["persistent-purpose-review"],
  "ownedAgents": [],
  "ownedInstructions": [],
  "dependencies": [],
  "runtimeBoundary": "purpose-review-runner 0.5.0以上 / protocol v4は独立して導入する外部CLIであり、pluginには含まれない。"
}
