{
  "schemaVersion": 1,
  "package": "pr-review-remediation",
  "installTargets": ["copilot", "codex", "agent-skills"],
  "ownedSkills": ["pr-review-remediation"],
  "ownedAgents": [],
  "ownedInstructions": [],
  "dependencies": [],
  "runtimeBoundary": "GitHub review request, collection, and remediation push require authenticated GitHub access; remote review content is untrusted, the current parent directly evaluates all sources and owns writes, and the verified push destination must match the PR head repository."
}
